{
  "schema": "kinetic/gym/case-run@0.2",
  "case_id": "case-5300412a00",
  "slots": {
    "V0": {
      "schema": "kinetic/gym/variant-run@0.2",
      "run_id": "run-case-5300412a00-v0",
      "case_id": "case-5300412a00",
      "slot": "V0",
      "mode": "fidelity-study",
      "state": "DESIGN_EVALUATED",
      "attempt": 3,
      "deployable": false,
      "original_work": false,
      "technically_qualified": true,
      "design_qualified": null,
      "acceptable_for_further_taste_learning": null,
      "refs": {
        "variant_brief": "runs/case-5300412a00/planning/v0/variant-brief.json",
        "retrieval_receipt": "runs/case-5300412a00/planning/v0/retrieval-receipt.json",
        "prebuild_review": "runs/case-5300412a00/planning/v0/prebuild-review.json",
        "build_receipt": "runs/case-5300412a00/variants/v0",
        "technical_evaluation": "runs/case-5300412a00/reports/technical-evaluation-v0.json",
        "capture_manifest": "runs/case-5300412a00/captures/v0/manifest.json",
        "design_evaluation": "runs/case-5300412a00/reports/design-evaluation-v0.json",
        "fidelity_report": "runs/case-5300412a00/reports/fidelity-v0.json"
      },
      "attempts": [
        {
          "attempt": 1,
          "status": "FAILED",
          "input_sha256": null,
          "artifact_refs": [],
          "diagnosis_ref": "runs/case-5300412a00/reports/repair-diagnosis-v0-attempt-1.json",
          "started_at": "2026-09-02T07:10:35.033Z",
          "ended_at": "2026-09-02T07:23:15.165Z"
        },
        {
          "attempt": 2,
          "status": "FAILED",
          "input_sha256": null,
          "artifact_refs": [],
          "diagnosis_ref": "runs/case-5300412a00/reports/repair-diagnosis-v0-attempt-2.json",
          "started_at": "2026-09-02T07:23:15.165Z",
          "ended_at": "2026-09-02T07:27:27.831Z"
        }
      ],
      "blocked_condition": null,
      "timestamps": {
        "PLANNED": "2026-09-02T07:07:15.579Z",
        "BRIEF_VALIDATED": "2026-09-02T07:08:22.430Z",
        "RETRIEVAL_PROVEN": "2026-09-02T07:10:17.537Z",
        "PREBUILD_APPROVED": "2026-09-02T07:10:26.051Z",
        "BUILDING": "2026-09-02T07:27:27.831Z",
        "BUILT": "2026-09-02T07:27:28.283Z",
        "TECHNICAL_EVALUATED": "2026-09-02T07:27:49.149Z",
        "VISUAL_CAPTURED": "2026-09-02T07:28:30.640Z",
        "DESIGN_EVALUATED": "2026-09-04T01:27:06.006Z"
      }
    },
    "V1": {
      "schema": "kinetic/gym/variant-run@0.2",
      "run_id": "run-case-5300412a00-v1",
      "case_id": "case-5300412a00",
      "slot": "V1",
      "mode": "original",
      "state": "HUMAN_REVIEWED",
      "attempt": 1,
      "deployable": true,
      "original_work": true,
      "technically_qualified": true,
      "design_qualified": false,
      "acceptable_for_further_taste_learning": false,
      "refs": {
        "variant_brief": "runs/case-5300412a00/planning/v1/variant-brief.json",
        "retrieval_receipt": "runs/case-5300412a00/planning/v1/retrieval-receipt.json",
        "prebuild_review": "runs/case-5300412a00/planning/v1/prebuild-review.json",
        "build_receipt": "runs/case-5300412a00/variants/v1",
        "technical_evaluation": "runs/case-5300412a00/reports/technical-evaluation-v1.json",
        "capture_manifest": "runs/case-5300412a00/captures/v1/manifest.json",
        "design_evaluation": "runs/case-5300412a00/reports/design-evaluation-v1.json",
        "fidelity_report": "runs/case-5300412a00/reports/fidelity-v0.json"
      },
      "attempts": [],
      "blocked_condition": null,
      "timestamps": {
        "PLANNED": "2026-09-04T01:28:55.503Z",
        "BRIEF_VALIDATED": "2026-09-04T01:34:04.667Z",
        "RETRIEVAL_PROVEN": "2026-09-04T01:34:31.972Z",
        "PREBUILD_APPROVED": "2026-09-04T01:34:38.134Z",
        "BUILDING": "2026-09-04T01:34:38.443Z",
        "BUILT": "2026-09-04T01:34:38.796Z",
        "TECHNICAL_EVALUATED": "2026-09-04T01:35:51.949Z",
        "VISUAL_CAPTURED": "2026-09-04T01:40:41.668Z",
        "DESIGN_EVALUATED": "2026-09-04T01:41:17.892Z",
        "REVIEW_READY": "2026-09-04T01:42:24.013Z",
        "HUMAN_REVIEWED": "2026-09-04T02:03:45.389Z"
      }
    },
    "V2": {
      "schema": "kinetic/gym/variant-run@0.2",
      "run_id": "run-case-5300412a00-v2",
      "case_id": "case-5300412a00",
      "slot": "V2",
      "mode": "original",
      "state": "HUMAN_REVIEWED",
      "attempt": 1,
      "deployable": true,
      "original_work": true,
      "technically_qualified": true,
      "design_qualified": false,
      "acceptable_for_further_taste_learning": false,
      "refs": {
        "variant_brief": "runs/case-5300412a00/planning/v2/variant-brief.json",
        "retrieval_receipt": "runs/case-5300412a00/planning/v2/retrieval-receipt.json",
        "prebuild_review": "runs/case-5300412a00/planning/v2/prebuild-review.json",
        "build_receipt": "runs/case-5300412a00/variants/v2",
        "technical_evaluation": "runs/case-5300412a00/reports/technical-evaluation-v2.json",
        "capture_manifest": "runs/case-5300412a00/captures/v2/manifest.json",
        "design_evaluation": "runs/case-5300412a00/reports/design-evaluation-v2.json",
        "fidelity_report": "runs/case-5300412a00/reports/fidelity-v0.json"
      },
      "attempts": [],
      "blocked_condition": null,
      "timestamps": {
        "PLANNED": "2026-09-04T01:28:55.832Z",
        "BRIEF_VALIDATED": "2026-09-04T01:34:04.977Z",
        "RETRIEVAL_PROVEN": "2026-09-04T01:34:32.262Z",
        "PREBUILD_APPROVED": "2026-09-04T01:34:39.085Z",
        "BUILDING": "2026-09-04T01:34:39.376Z",
        "BUILT": "2026-09-04T01:34:39.676Z",
        "TECHNICAL_EVALUATED": "2026-09-04T01:35:52.247Z",
        "VISUAL_CAPTURED": "2026-09-04T01:40:41.965Z",
        "DESIGN_EVALUATED": "2026-09-04T01:41:18.243Z",
        "REVIEW_READY": "2026-09-04T01:42:24.013Z",
        "HUMAN_REVIEWED": "2026-09-04T02:03:45.389Z"
      }
    }
  },
  "reports": {
    "fidelity": "runs/case-5300412a00/reports/fidelity-v0.json",
    "source_to_output_loss": "runs/case-5300412a00/reports/source-to-output-loss.json",
    "review_package": "runs/case-5300412a00/review-package.html"
  },
  "review_state": "HUMAN_REVIEWED",
  "taste_decision_ref": "taste/decisions/td-20260904-reactbits-v1-v2.json",
  "blocked_condition": null,
  "history": [
    {
      "event_id": "init-case-5300412a00",
      "event": "phase2.5-init-v0",
      "slot": "V0",
      "artifact_ref": null,
      "timestamp": "2026-09-02T07:07:15.579Z"
    },
    {
      "event_id": "transition-run-case-5300412a00-v0-1-PLANNED-BRIEF_VALIDATED",
      "event": "PLANNED->BRIEF_VALIDATED",
      "slot": "V0",
      "artifact_ref": null,
      "timestamp": "2026-09-02T07:08:22.430Z"
    },
    {
      "event_id": "transition-run-case-5300412a00-v0-1-BRIEF_VALIDATED-RETRIEVAL_PROVEN",
      "event": "BRIEF_VALIDATED->RETRIEVAL_PROVEN",
      "slot": "V0",
      "artifact_ref": null,
      "timestamp": "2026-09-02T07:10:17.537Z"
    },
    {
      "event_id": "transition-run-case-5300412a00-v0-1-RETRIEVAL_PROVEN-PREBUILD_APPROVED",
      "event": "RETRIEVAL_PROVEN->PREBUILD_APPROVED",
      "slot": "V0",
      "artifact_ref": null,
      "timestamp": "2026-09-02T07:10:26.051Z"
    },
    {
      "event_id": "transition-run-case-5300412a00-v0-1-PREBUILD_APPROVED-BUILDING",
      "event": "PREBUILD_APPROVED->BUILDING",
      "slot": "V0",
      "artifact_ref": null,
      "timestamp": "2026-09-02T07:10:35.033Z"
    },
    {
      "event_id": "transition-run-case-5300412a00-v0-1-BUILDING-BUILT",
      "event": "BUILDING->BUILT",
      "slot": "V0",
      "artifact_ref": null,
      "timestamp": "2026-09-02T07:17:28.532Z"
    },
    {
      "event_id": "transition-run-case-5300412a00-v0-1-BUILT-TECHNICAL_EVALUATED",
      "event": "BUILT->TECHNICAL_EVALUATED",
      "slot": "V0",
      "artifact_ref": null,
      "timestamp": "2026-09-02T07:18:48.434Z"
    },
    {
      "event_id": "retry-run-case-5300412a00-v0-2",
      "event": "retry-from-TECHNICAL_EVALUATED",
      "slot": "V0",
      "artifact_ref": "runs/case-5300412a00/reports/repair-diagnosis-v0-attempt-1.json",
      "timestamp": "2026-09-02T07:23:15.165Z"
    },
    {
      "event_id": "transition-run-case-5300412a00-v0-2-BUILDING-BUILT",
      "event": "BUILDING->BUILT",
      "slot": "V0",
      "artifact_ref": null,
      "timestamp": "2026-09-02T07:23:30.866Z"
    },
    {
      "event_id": "transition-run-case-5300412a00-v0-2-BUILT-TECHNICAL_EVALUATED",
      "event": "BUILT->TECHNICAL_EVALUATED",
      "slot": "V0",
      "artifact_ref": null,
      "timestamp": "2026-09-02T07:23:55.344Z"
    },
    {
      "event_id": "retry-run-case-5300412a00-v0-3",
      "event": "retry-from-TECHNICAL_EVALUATED",
      "slot": "V0",
      "artifact_ref": "runs/case-5300412a00/reports/repair-diagnosis-v0-attempt-2.json",
      "timestamp": "2026-09-02T07:27:27.831Z"
    },
    {
      "event_id": "transition-run-case-5300412a00-v0-3-BUILDING-BUILT",
      "event": "BUILDING->BUILT",
      "slot": "V0",
      "artifact_ref": null,
      "timestamp": "2026-09-02T07:27:28.283Z"
    },
    {
      "event_id": "transition-run-case-5300412a00-v0-3-BUILT-TECHNICAL_EVALUATED",
      "event": "BUILT->TECHNICAL_EVALUATED",
      "slot": "V0",
      "artifact_ref": null,
      "timestamp": "2026-09-02T07:27:49.149Z"
    },
    {
      "event_id": "transition-run-case-5300412a00-v0-3-TECHNICAL_EVALUATED-VISUAL_CAPTURED",
      "event": "TECHNICAL_EVALUATED->VISUAL_CAPTURED",
      "slot": "V0",
      "artifact_ref": null,
      "timestamp": "2026-09-02T07:28:30.640Z"
    },
    {
      "event_id": "transition-run-case-5300412a00-v0-3-VISUAL_CAPTURED-DESIGN_EVALUATED",
      "event": "VISUAL_CAPTURED->DESIGN_EVALUATED",
      "slot": "V0",
      "artifact_ref": null,
      "timestamp": "2026-09-04T01:27:06.006Z"
    },
    {
      "event_id": "add-case-5300412a00-V1",
      "event": "original-slot-planned",
      "slot": "V1",